{
  "$schema": "./schemas/metamap-graph.schema.json",
  "authorities": [
    {
      "concept": "urn:example:claim:first-obstruction",
      "facts": ["statement", "workflow-state"],
      "id": "urn:example:authority:first-obstruction",
      "mode": "canonical",
      "provenance": {
        "assertedBy": "research-machine-exporter@1.0.0",
        "status": "observed"
      },
      "source": "urn:example:claim:first-obstruction"
    }
  ],
  "entities": [
    {
      "id": "urn:example:claim:first-obstruction",
      "kind": "claim",
      "label": "Constraint-preserving composition is the first obstruction",
      "locators": [
        {
          "uri": "research-machine://qm-gr-rebuild/claims/c3"
        }
      ],
      "provenance": {
        "assertedBy": "research-machine-exporter@1.0.0",
        "status": "observed"
      }
    },
    {
      "attributes": {
        "workflowState": "unreviewed"
      },
      "id": "urn:example:hypothesis:mathematical-axiom",
      "kind": "hypothesis",
      "label": "A changed mathematical axiom is necessary",
      "locators": [
        {
          "uri": "research-machine://qm-gr-rebuild/hypotheses/c6"
        }
      ],
      "provenance": {
        "assertedBy": "research-machine-exporter@1.0.0",
        "status": "observed"
      }
    },
    {
      "attributes": {
        "workflowState": "unreviewed"
      },
      "id": "urn:example:hypothesis:physical-postulate",
      "kind": "hypothesis",
      "label": "A revised physical postulate is sufficient",
      "locators": [
        {
          "uri": "research-machine://qm-gr-rebuild/hypotheses/c7"
        }
      ],
      "provenance": {
        "assertedBy": "research-machine-exporter@1.0.0",
        "status": "observed"
      }
    },
    {
      "id": "urn:example:assumption:cross-regime-value",
      "kind": "assumption",
      "label": "Reconciliation requires cross-regime structure or discriminating value",
      "provenance": {
        "assertedBy": "research-program",
        "status": "declared"
      }
    },
    {
      "attributes": {
        "workflowState": "draft"
      },
      "id": "urn:example:protocol:i6-interface",
      "kind": "protocol",
      "label": "Frozen I6 interface protocol",
      "provenance": {
        "assertedBy": "research-machine-exporter@1.0.0",
        "status": "observed"
      }
    },
    {
      "id": "urn:example:regime:phase-1",
      "kind": "research-context",
      "label": "Phase 1 quantum-geometry interface scope",
      "provenance": {
        "assertedBy": "research-program",
        "status": "declared"
      }
    }
  ],
  "id": "urn:example:metamap:research",
  "label": "Research Machine federation example",
  "mappings": [
    {
      "cardinality": "one-to-one",
      "id": "urn:example:mapping:first-obstruction-assumption",
      "lossiness": "lossless",
      "provenance": {
        "assertedBy": "research-program",
        "status": "declared"
      },
      "relation": "research:assumes",
      "sources": ["urn:example:claim:first-obstruction"],
      "targets": ["urn:example:assumption:cross-regime-value"]
    },
    {
      "cardinality": "one-to-one",
      "id": "urn:example:mapping:mechanism-competitors",
      "lossiness": "lossless",
      "provenance": {
        "assertedBy": "research-program",
        "status": "declared"
      },
      "relation": "research:competes_with",
      "sources": ["urn:example:hypothesis:mathematical-axiom"],
      "targets": ["urn:example:hypothesis:physical-postulate"]
    },
    {
      "cardinality": "one-to-many",
      "id": "urn:example:mapping:protocol-tests-mechanisms",
      "lossiness": "lossless",
      "provenance": {
        "assertedBy": "research-program",
        "status": "declared"
      },
      "relation": "research:tests",
      "sources": ["urn:example:protocol:i6-interface"],
      "targets": [
        "urn:example:hypothesis:mathematical-axiom",
        "urn:example:hypothesis:physical-postulate"
      ]
    },
    {
      "cardinality": "one-to-one",
      "id": "urn:example:mapping:axiom-phase-scope",
      "lossiness": "lossless",
      "provenance": {
        "assertedBy": "research-program",
        "status": "declared"
      },
      "relation": "research:valid_under",
      "sources": ["urn:example:hypothesis:mathematical-axiom"],
      "targets": ["urn:example:regime:phase-1"]
    },
    {
      "cardinality": "one-to-one",
      "id": "urn:example:mapping:postulate-phase-scope",
      "lossiness": "lossless",
      "provenance": {
        "assertedBy": "research-program",
        "status": "declared"
      },
      "relation": "research:valid_under",
      "sources": ["urn:example:hypothesis:physical-postulate"],
      "targets": ["urn:example:regime:phase-1"]
    }
  ],
  "metadata": {
    "composedFrom": [
      "urn:example:metamap:research:discovered",
      "urn:example-research:metamap-shard:urn%3Aexample%3Ametamap%3Aresearch%3Adeclared"
    ]
  },
  "namespace": "example-research",
  "relationPacks": [
    {
      "id": "urn:metamap:relation-pack:core",
      "version": "1.0.0"
    },
    {
      "digest": "sha256:5203efd827b8fac9c532e70f2f4c9fc90ac809609074251b4e5170faa111a6a9",
      "id": "urn:metamap:relation-pack:research",
      "uri": "relation-packs/research.json",
      "version": "1.0.0"
    }
  ],
  "revision": "sha256:1a41823c20a579de2b559da6b20f203dc89b7f58bfb3999cb0fa28bea4603a73",
  "schemaVersion": "2.0.0"
}
