{
  "schemaVersion": "2.0.0",
  "id": "urn:provenance:source:network",
  "namespace": "dependency-example",
  "revision": "network-r1",
  "entities": [
    {
      "id": "urn:example:consumer",
      "kind": "configuration",
      "label": "consumer",
      "attributes": {
        "path": "/network/:networkId"
      }
    },
    {
      "id": "urn:example:service",
      "kind": "configuration",
      "label": "service"
    }
  ],
  "mappings": [
    {
      "id": "urn:example:consumer-service",
      "relation": "example:depends",
      "sources": ["urn:example:consumer"],
      "targets": ["urn:example:service"],
      "cardinality": "one-to-one",
      "lossiness": "lossless",
      "provenance": {
        "status": "declared",
        "assertedBy": "consumer-owner"
      }
    }
  ],
  "authorities": []
}
