{
  "schemaVersion": "2.0.0",
  "id": "urn:metamap:example:dependency-graph",
  "namespace": "dependency-example",
  "revision": "1",
  "entities": [
    {
      "id": "urn:example:consumer",
      "kind": "configuration",
      "label": "consumer"
    },
    {
      "id": "urn:example:service",
      "kind": "configuration",
      "label": "service"
    },
    {
      "id": "urn:example:schema",
      "kind": "configuration",
      "label": "schema"
    }
  ],
  "mappings": [
    {
      "id": "urn:example:consumer-service",
      "relation": "example:depends",
      "sources": ["urn:example:consumer"],
      "targets": ["urn:example:service"],
      "cardinality": "one-to-one",
      "lossiness": "lossless",
      "provenance": {
        "status": "declared",
        "assertedBy": "consumer-owner"
      }
    },
    {
      "id": "urn:example:service-schema",
      "relation": "example:depends",
      "sources": ["urn:example:service"],
      "targets": ["urn:example:schema"],
      "cardinality": "one-to-one",
      "lossiness": "lossless",
      "provenance": {
        "status": "declared",
        "assertedBy": "service-owner"
      }
    }
  ],
  "authorities": []
}
